2026-09-04,"Fri 04 Sep, 1:00 PM ET",Prediction Markets Forum,Methodology / practitioner prompt,Payout Latency League Table,Compare the operational journey from outcome to usable funds across venues and market types.,Planned,High,"Separate source delay, platform decision time and withdrawal time.",,,,,NEXTPredict proprietary data journalism research
2026-09-07,"Mon 07 Sep, 8:00 AM ET",Stuart LinkedIn,Flagship data investigation,The Prediction-Market Change Log,"Reveal wording and source changes made after trading begins, including clauses added during controversy.",Planned,Critical,Store timestamped snapshots and distinguish clerical edits from substantive changes.,,,,,NEXTPredict proprietary data journalism research
2026-09-07,"Mon 07 Sep, 10:30 AM ET",X,NUMBER OF THE WEEK data card,NUMBER OF THE WEEK: senior prediction-market hires in the past 90 days,"Count verified moves across exchanges, regulators, market makers, sportsbooks, compliance and infrastructure.",Planned / data-gated,High,"Use public role announcements and dates. Exclude unverified titles, open jobs and ordinary team growth.",,,,"sports (today x5, all-time 1131)",NEXTPredict talent-migration tracker; company announcements; LinkedIn profiles.
2026-09-09,"Wed 09 Sep, 8:00 AM ET",Stuart LinkedIn,THE TAPE profile card + developed post,THE TAPE: Robin Hanson and the distance from forecasting to governance,Profile the thinker behind futarchy without pretending every current event contract is an implementation of it.,Planned / verification-gated,High,"Confirm current affiliation, original futarchy framing and any current prediction-market involvement.",Robin [confirmed partner],Robin Hanson [connector; connector; Verify public handle],NEWS: AppliedXL and Kalshi · YOUTUBE: ICYMI · YOUTUBE: The CRT Report · LINKEDIN: Danny Li · NEWS: human Magazin,,George Mason University biography; Robin Hanson published work.
2026-09-09,"Wed 09 Sep, 9:00 AM ET",X,Thread + data visual,The Market Graveyard,Study product failures and governance decisions that disappear from the live market feed.,Planned,High,Capture removal timestamps and distinguish voids from normal expiries.,,,,,NEXTPredict proprietary data journalism research
2026-09-10,"Thu 10 Sep, 8:00 AM ET",Stuart LinkedIn,I Spoke To quote-led post,I SPOKE TO #01: one useful industry conversation,"Publish only when a call produces a genuinely useful line. Lead with one approved quote, explain why it matters, then add Stuart’s commercial read in one or two paragraphs.",Conditional,High,"Obtain quote approval, confirm current role and verify every operational or numerical claim.",,,,,Recorded call notes and guest-approved quote
2026-09-11,"Fri 11 Sep, 1:00 PM ET",Prediction Markets Forum,Methodology / practitioner prompt,Probability Half-Life,Show how long a market number remains useful after publication and what context was missing when it was quoted.,Planned,High,Use the live market at the exact publication timestamp and document liquidity.,,,,,NEXTPredict proprietary data journalism research
2026-09-14,"Mon 14 Sep, 8:00 AM ET",Stuart LinkedIn,Flagship data investigation,Probability Laundering,Follow a number from a small market move through headlines until it returns as supposed public consensus.,Planned,Critical,Timestamp every stage and distinguish correlation from causation.,,,,,NEXTPredict proprietary data journalism research
2026-09-14,"Mon 14 Sep, 10:30 AM ET",X,NUMBER OF THE WEEK data card,NUMBER OF THE WEEK: prediction-market distribution surfaces beyond native apps,"Count verified brokerages, wallets, AI answers, media embeds, commerce activations and venue partnerships.",Planned / data-gated,High,"Count only live or officially announced integrations. Separate data display, account routing and actual trading access.",,,,,NEXTPredict distribution tracker; company announcements and product captures.
2026-09-16,"Wed 16 Sep, 8:00 AM ET",Stuart LinkedIn,THE TAPE profile card + developed post,THE TAPE: Megan McGrath and the compliance rebuild at Polymarket,Use the move from Robinhood to Polymarket to examine what a US return requires beyond licensing headlines.,Planned / verification-gated,High,"Verify current role, start date, prior remit and any public description of the US compliance programme.",Polymarket [abm] · Robinhood [abm],Megan McGrath [Verify current handle],NEWS: CNBC · NEWS: FinanceFeeds · NEWS: AppliedXL and Kalshi · NEWS: Arizona State University / arXiv · NEWS: Samsung Securities · X: Predictefy (@Predictefy),"polymarket (today x9, all-time 1127)",Polymarket announcement; executive LinkedIn; regulatory filings.
2026-09-16,"Wed 16 Sep, 9:00 AM ET",X,Thread + data visual,The Media-Market Feedback Loop,"Trace how a probability becomes a headline, attracts new trading and returns to the media as supposed confirmation.",Planned,Critical,Avoid causal claims unless timing and counterfactual evidence support them.,,,,,NEXTPredict proprietary data journalism research
2026-09-17,"Thu 17 Sep, 8:00 AM ET",Stuart LinkedIn,The Tape profile + career timeline,THE TAPE #04: Elie Mishory and Novig,"Use the career path across public regulation, an established venue and a new sports-focused exchange as a talent signal. The point is where Novig expects regulatory and operating complexity to sit.",Conditional,High,"Verify the employment timeline, exact titles, prior CFTC role and Novig regulatory status.",Novig [target] · elie mishory [mentioned],,X: Predictefy (@Predictefy) · X: Novig (@Novig) · LINKEDIN: Eventus · LINKEDIN: Jay Malavia,"regulation (today x7, all-time 1564) · sports (today x5, all-time 1131) · cftc (today x3, all-time 72)","Novig announcement, CFTC biography, LinkedIn and filings"
2026-09-18,"Fri 18 Sep, 10:30 AM ET",Stuart LinkedIn,COMPANY FILE + clearing visual,COMPANY FILE: Vermiculus and the clearing engine for always-on markets,"Move beyond the executive profile to show the company, technology and operational requirements of 24/7 clearing.",Planned / verification-gated,High,"Verify deployments, named customers, availability claims, resilience model and current prediction-market relevance.",vermiculus [pierre-target],,,,https://www.vermiculus.se
2026-09-18,"Fri 18 Sep, 1:00 PM ET",Prediction Markets Forum,Methodology / practitioner prompt,The Prediction-Market Journalism Audit,Assess how accurately major publishers use prediction-market probabilities in public reporting.,Planned,High,Publish the scoring rubric and offer outlets a right of reply.,,,,,NEXTPredict proprietary data journalism research
2026-09-21,"Mon 21 Sep, 8:00 AM ET",Stuart LinkedIn,Flagship data investigation,The Whale Consensus Illusion,Separate broad agreement from a probability moved by one or two concentrated participants.,Planned,Critical,Publish wallet-clustering assumptions and avoid naming individuals without proof.,,,,,NEXTPredict proprietary data journalism research
2026-09-21,"Mon 21 Sep, 10:30 AM ET",X,NUMBER OF THE WEEK data card,NUMBER OF THE WEEK: how concentrated is “the market” in its ten largest positions?,Use one high-volume contract to show the share of open interest or exposure held by the largest visible wallets or accounts.,Planned / data-access gated,Critical,"Use public data only, disclose account-linkage limits and avoid identity claims. Distinguish volume, exposure and open interest.",,,,,Venue API or on-chain data; NEXTPredict Whale Watch methodology.
2026-09-23,"Wed 23 Sep, 8:00 AM ET",Stuart LinkedIn,THE TAPE profile card + developed post,THE TAPE: Michael Ross and the new MNPI control surface,Profile the compliance practitioner arguing that prediction markets create another channel through which employees can monetise confidential information.,Planned / verification-gated,High,"Confirm title, original argument, examples and the boundaries of StarCompliance product claims.",,Michael Ross [candidate; LinkedIn / StarCompliance],LINKEDIN: TabbFORUM,"prediction_markets (today x7, all-time 1009)",https://www.starcompliance.com and original Michael Ross commentary.
2026-09-23,"Wed 23 Sep, 9:00 AM ET",X,Thread + data visual,Market-Maker Dependency Score,Identify markets whose apparent liquidity relies on one participant rather than a resilient two-sided ecosystem.,Planned,Critical,Use behavioural signatures carefully and avoid naming firms without confirmation.,,,,,NEXTPredict proprietary data journalism research
2026-09-24,"Thu 24 Sep, 8:00 AM ET",Stuart LinkedIn,I Spoke To quote-led post,"I SPOKE TO #02: founder, trader or market maker","Choose a conversation that reveals one hard operating decision around liquidity, settlement, surveillance, distribution or capital. Avoid generic origin stories.",Conditional,High,Guest approves the quote and description. Verify supporting documents and avoid implying endorsement.,,,,,Recorded call notes and primary supporting source
2026-09-25,"Fri 25 Sep, 1:00 PM ET",Prediction Markets Forum,Methodology / practitioner prompt,The Liquidity Family Tree,Show where apparently competing consumer products rely on the same underlying institutions.,Planned,Critical,Use confirmed commercial relationships and label inferred links clearly.,,,,,NEXTPredict proprietary data journalism research
2026-09-28,"Mon 28 Sep, 8:00 AM ET",Stuart LinkedIn,Flagship data investigation,The Insider Proximity Score,Rank contracts by how many people may know the answer before the public and how easily that knowledge could be traded.,Planned,Critical,"Use process evidence, not accusations against named individuals.",,,,,NEXTPredict proprietary data journalism research
2026-09-28,"Mon 28 Sep, 10:30 AM ET",X,NUMBER OF THE WEEK data card,NUMBER OF THE WEEK: median time to settle a sampled market,Measure the gap between the outcome becoming knowable and users receiving a final resolution across a consistent sample.,Planned / methodology-gated,High,"Define knowable time, provisional result, final settlement and disputes. Use a transparent sample and timestamps.",,,,,NEXTPredict settlement archive; venue rulebooks and market pages.
2026-09-30,"Wed 30 Sep, 8:00 AM ET",Stuart LinkedIn,THE TAPE profile card + developed post,THE TAPE: Tim McCourt and the traditional-exchange route into event contracts,Profile a senior CME executive at the point where established derivatives infrastructure meets retail event products.,Planned / verification-gated,High,"Confirm current title, product remit, public comments and any live or announced event-contract products.",,Tim McCourt [Verify public handle],,,https://www.cmegroup.com and official executive biography.
2026-09-30,"Wed 30 Sep, 9:00 AM ET",X,Thread + data visual,Pre-Announcement Leakage Index,"Compare prediction-market movement before material filings with stock, options and already-public information.",Planned,Critical,Control for public rumours and use the official filing timestamp.,,,,,NEXTPredict proprietary data journalism research
2026-10-01,"Thu 01 Oct, 8:00 AM ET",Stuart LinkedIn,The Tape profile + research graphic,THE TAPE #05: Philip Tetlock and ForecastEx,"Connect the academic history of superforecasting with the commercial exchange layer. Ask what changes when forecasting skill has to survive price, entry, execution and risk.",Conditional,High,"Verify the board appointment, current role, ForecastEx structure and all research claims.",interactive brokers [mentioned],Philip Tetlock [connector; connector; Verify handle],NEWS: Arizona State University / arXiv · LINKEDIN: Interactive Brokers · YOUTUBE: Oscar Fontecha,,ForecastEx / Interactive Brokers announcement and university sources
2026-10-02,"Fri 02 Oct, 10:30 AM ET",Stuart LinkedIn,COMPANY FILE + surveillance visual,COMPANY FILE: Solidus Labs and surveillance as product infrastructure,"Explain how cross-market monitoring, manipulation detection and case management sit behind exchange credibility.",Planned / verification-gated,High,"Confirm relevant customers or use cases, product capabilities and any prediction-market-specific work before implying a relationship.",solidus labs [pierre-target],,,,https://www.soliduslabs.com
2026-10-02,"Fri 02 Oct, 1:00 PM ET",Prediction Markets Forum,Methodology / practitioner prompt,Prediction Markets in Corporate Filings,Find where prediction markets first appear in official corporate language before they become headline strategy.,Planned,High,Quote filings exactly and distinguish company statements from analyst questions.,,,,"prediction_markets (today x7, all-time 1009)",NEXTPredict proprietary data journalism research
2026-10-05,"Mon 05 Oct, 8:00 AM ET",Stuart LinkedIn,Flagship data investigation,Prediction Markets Versus Options,Find economically equivalent contracts and quantify where retail event markets diverge from conventional derivatives.,Planned,Critical,"Match exact expiry, threshold, settlement source and trading timestamp.",,,,"prediction_markets (today x7, all-time 1009)",NEXTPredict proprietary data journalism research
2026-10-05,"Mon 05 Oct, 10:30 AM ET",X,NUMBER OF THE WEEK data card,NUMBER OF THE WEEK: prediction-market mentions in corporate filings and earnings materials,"Track how often listed gaming, brokerage, media and financial companies cite prediction markets as an opportunity, risk or competitive pressure.",Planned / research-gated,High,Search a defined filing universe and date range. Quote exact language and separate management commentary from analyst questions.,,,,"prediction_markets (today x7, all-time 1009)",SEC EDGAR; company earnings materials; NEXTPredict filing tracker.
2026-10-07,"Wed 07 Oct, 8:00 AM ET",Stuart LinkedIn,THE TAPE profile card + developed post,THE TAPE: Luana Lopes Lara and the operating build behind Kalshi,"Profile the co-founder through product, operations and category-building decisions rather than personal wealth or founder mythology.",Planned / verification-gated,High,"Confirm role, operating remit, public comments, company milestones and any numerical claims.",Kalshi [abm],Luana Lopes Lara [shortlist; @luanalopeslara],NEWS: CNBC · NEWS: FinanceFeeds · NEWS: AppliedXL and Kalshi · X: Predictefy (@Predictefy) · X: Timcast News (@TimcastNews) · X: Quant Chad (@Autonomous_Chad),"kalshi (today x6, all-time 957)",https://kalshi.com and primary interviews or company materials.
2026-10-07,"Wed 07 Oct, 9:00 AM ET",X,Thread + data visual,Cross-Venue Disagreement Monitor,Find genuine information disagreement after removing differences caused by contract wording and fees.,Planned,Critical,Publish the matching methodology and timestamp every observation.,,,,,NEXTPredict proprietary data journalism research
2026-10-08,"Thu 08 Oct, 8:00 AM ET",Stuart LinkedIn,I Spoke To quote-led post,I SPOKE TO #03: exchange or clearing operator,"Use a pre-summit conversation to explain what breaks when volume, intermediaries and regulation arrive together. Keep the event connection soft and useful.",Conditional,High,"Obtain quote approval and verify all technical, regulatory and volume claims.",,,,"regulation (today x7, all-time 1564)",Recorded call notes and primary product/regulatory sources
2026-10-09,"Fri 09 Oct, 1:00 PM ET",Prediction Markets Forum,Methodology / practitioner prompt,The Probability Tax,Measure the true cost of buying and exiting the same probability at different venues and trade sizes.,Planned,High,Use timestamped executable prices rather than displayed midpoints.,,,,,NEXTPredict proprietary data journalism research
2026-10-10,"Sat 10 Oct, 11:30 AM ET",X,Odd Spot image post,ODD SPOT #02: the best verified unexpected appearance of the fortnight,"Use a real sponsorship, venue placement, commerce embed, giveaway or entertainment crossover. Start human, then explain what it says about distribution or category perception.",Reactive,Medium,Confirm the relationship and activation through the company or venue. Avoid screenshot-only claims.,,,,,Latest research queue and primary partner announcement
2026-10-12,"Mon 12 Oct, 8:00 AM ET",Stuart LinkedIn,Flagship data investigation,The Information-Arrival Fingerprint,"Show how different categories absorb information through jumps, gradual repricing or event-driven bursts.",Planned,High,Use comparable samples and distinguish scheduled from unscheduled information.,the information [mentioned],,NEWS: FinanceFeeds · NEWS: AppliedXL and Kalshi · NEWS: Arizona State University / arXiv · YOUTUBE: Indexed Podcast · LINKEDIN: Enrique R. Ubarri · LINKEDIN: James Daley,,NEXTPredict proprietary data journalism research
2026-10-12,"Mon 12 Oct, 10:30 AM ET",X,NUMBER OF THE WEEK data card,NUMBER OF THE WEEK: verified partnerships announced this quarter,"Count partnerships across data, media, sports, distribution, infrastructure and commerce, then show which category is growing fastest.",Planned / data-gated,High,"Use official announcements, define partnership consistently and exclude ordinary vendors or unconfirmed media references.",,,,"sports (today x5, all-time 1131)",NEXTPredict partnership tracker; company newsrooms and filings.
2026-10-14,"Wed 14 Oct, 8:00 AM ET",Stuart LinkedIn,THE TAPE profile card + developed post,THE TAPE: Mike Selig and the federal market-structure argument,"Profile the regulator through orders, speeches and the practical consequences of federal pre-emption and contract finality.",Planned / officeholder verification,Critical,"Confirm current office, title, relevant orders and wording immediately before publication. Use primary CFTC sources.",cftc [mentioned],Mike Selig [@ChairmanSelig],NEWS: AppliedXL and Kalshi · X: Lucas Martin Calderon (@lmc_security) · X: Mike Selig (@ChairmanSelig) · YOUTUBE: Axios Live,"cftc (today x3, all-time 72)",https://www.cftc.gov
2026-10-14,"Wed 14 Oct, 9:00 AM ET",X,Thread + data visual,The Five-Minute Penalty,Test whether ultra-short contracts create a materially different manipulation surface from longer markets.,Planned,High,Replicate published methods where possible and state dataset limitations.,,,,,NEXTPredict proprietary data journalism research
2026-10-15,"Thu 15 Oct, 8:00 AM ET",Stuart LinkedIn,The Tape profile + 4:5 image,THE TAPE #06: one confirmed person or company in the NEXTPredict room,"Profile a confirmed participant whose work makes the summit’s market-structure positioning tangible. Explain why they matter to the category, then use a restrained “in the room” close.",Conditional,Critical,Confirm attendance or speaking status internally and verify all profile facts and image rights.,,,,,Internal event confirmation plus primary public sources
2026-10-16,"Fri 16 Oct, 10:30 AM ET",Stuart LinkedIn,COMPANY FILE + control-stack visual,COMPANY FILE: StarCompliance and the employee-control stack,"Show how restricted lists, attestations, surveillance and case workflows may need to adapt when employees can trade event contracts outside traditional brokerages.",Planned / verification-gated,High,Verify product capabilities and avoid implying a client relationship or legal requirement without evidence.,StarCompliance [pierre-target],,LINKEDIN: TabbFORUM · LINKEDIN: Stuart Crowley,"prediction_markets (today x7, all-time 1009)",https://www.starcompliance.com
2026-10-16,"Fri 16 Oct, 1:00 PM ET",Prediction Markets Forum,Methodology / practitioner prompt,The Outcome Influenceability Index,Quantify how easy it is for a trader to affect the metric used to settle the contract.,Planned,Critical,Document the mechanism and avoid operational instructions for manipulation.,,,,,NEXTPredict proprietary data journalism research
2026-10-19,"Mon 19 Oct, 8:00 AM ET",Stuart LinkedIn,Flagship data investigation,The $100 Contract Supply Chain,"Follow one ordinary trade through the full operating stack and show where money, risk and responsibility move.",Planned,Critical,Confirm each layer and avoid assuming commercial terms that are not public.,,,,,NEXTPredict proprietary data journalism research
2026-10-19,"Mon 19 Oct, 10:30 AM ET",X,NUMBER OF THE WEEK data card,NUMBER OF THE WEEK: the prediction-market talent migration count,"Map senior moves from regulators, exchanges, sportsbooks, market makers, crypto firms, compliance and data companies into the category.",Planned / data-gated,High,"Use verified public moves, a fixed date window and a clear definition of senior or specialist talent.",,,,"sports (today x5, all-time 1131)",NEXTPredict talent-migration tracker; company announcements; LinkedIn profiles.
2026-10-21,"Wed 21 Oct, 8:00 AM ET",Stuart LinkedIn,THE TAPE profile card + developed post,THE TAPE: Daniel Taylor and forensic analytics for prediction markets,Profile the Wharton forensic-analytics leader as a bridge between academic detection methods and practical exchange surveillance.,Planned / verification-gated,High,"Confirm current role, relevant research and willingness to discuss prediction-market applications. Do not imply work for a venue without confirmation.",,Daniel Taylor [Verify handle],,"prediction_markets (today x7, all-time 1009)",Wharton official biography and published forensic-analytics research.
2026-10-21,"Wed 21 Oct, 9:00 AM ET",X,Thread + data visual,Market Before the Market,Identify products and strategic moves before the announcement by combining weak public signals.,Planned,Critical,Treat signals as indications until a company confirms the product.,,,,,NEXTPredict proprietary data journalism research
2026-10-23,"Fri 23 Oct, 1:00 PM ET",Prediction Markets Forum,Methodology / practitioner prompt,Prediction-Market Comment Network,Map the coalitions and repeated arguments behind prediction-market rulemaking.,Planned,High,Quote narrowly and distinguish shared positions from shared authorship.,,,,,NEXTPredict proprietary data journalism research
2026-10-26,"Mon 26 Oct, 8:00 AM ET",Stuart LinkedIn,Flagship data investigation,The Regulatory Product Atlas,"Show what users can actually trade in each state or country, rather than publishing another legal timeline.",Planned,Critical,Date-stamp every jurisdiction and link to the governing source.,,,,,NEXTPredict proprietary data journalism research
2026-10-28,"Wed 28 Oct, 9:00 AM ET",X,Thread + data visual,State Regulator Copy-Paste Tracker,Trace repeated legal language and identify where arguments spread across jurisdictions.,Planned,High,Use document versions and avoid implying coordination solely from similarity.,,,,,NEXTPredict proprietary data journalism research
2026-10-30,"Fri 30 Oct, 1:00 PM ET",Prediction Markets Forum,Methodology / practitioner prompt,The Regulatory Copy Machine,Trace how legal arguments travel across institutions and identify the organisations shaping the vocabulary.,Planned,High,Do not infer common authorship from text similarity alone.,,,,,NEXTPredict proprietary data journalism research
2026-11-02,"Mon 02 Nov, 8:00 AM ET",Stuart LinkedIn,Flagship data investigation,Attention-to-Liquidity Conversion Rate,Identify topics that generate noise without durable trading and quieter categories that attract serious capital.,Planned,High,Normalise time windows and disclose data-access limits.,,,,,NEXTPredict proprietary data journalism research
2026-11-04,"Wed 04 Nov, 9:00 AM ET",X,Thread + data visual,The Marketing-to-Liquidity Ratio,Measure whether promotional attention becomes durable market activity rather than a one-day volume spike.,Planned,High,Separate estimated media activity from confirmed spend.,,,,,NEXTPredict proprietary data journalism research
2026-11-06,"Fri 06 Nov, 1:00 PM ET",Prediction Markets Forum,Methodology / practitioner prompt,The Unasked Questions Index,Use absence to reveal platform editorial choices and product constraints.,Planned,High,Label reasons as hypotheses unless confirmed by the platform.,,,,,NEXTPredict proprietary data journalism research
2026-11-09,"Mon 09 Nov, 8:00 AM ET",Stuart LinkedIn,Flagship data investigation,The Missing Markets Index,Turn the absence of a market into a story about product boundaries and risk appetite.,Planned,High,Ask platforms for comment before assigning a reason.,,,,,NEXTPredict proprietary data journalism research
2026-11-11,"Wed 11 Nov, 9:00 AM ET",X,Thread + data visual,Outcome-Manipulation Surface,Rank contracts by how directly participants can influence the measured outcome after taking a position.,Planned,Critical,Separate theoretical influence from documented manipulation evidence.,,,,"insider_trading (today x5, all-time 33)",NEXTPredict proprietary data journalism research
2026-11-13,"Fri 13 Nov, 1:00 PM ET",Prediction Markets Forum,Methodology / practitioner prompt,The Morality Premium,"Test whether morally sensitive subjects carry a measurable liquidity, concentration or participation penalty.",Planned,Medium,Use careful language and avoid sensationalising human harm.,,,,,NEXTPredict proprietary data journalism research
2026-11-16,"Mon 16 Nov, 8:00 AM ET",Stuart LinkedIn,Flagship data investigation,Brand Exposure Before Consent,"Show how companies, celebrities and leagues can become tradable narratives before they choose to engage with the category.",Planned,High,Separate nominative references from confirmed commercial partnerships.,,,,,NEXTPredict proprietary data journalism research
2026-11-18,"Wed 18 Nov, 9:00 AM ET",X,Thread + data visual,The Price of Official Rights,"Quantify whether official rights improve trust, liquidity and settlement quality or mainly change marketing.",Planned,High,Use comparable periods and control for event seasonality.,,,,,NEXTPredict proprietary data journalism research
2026-11-20,"Fri 20 Nov, 1:00 PM ET",Prediction Markets Forum,Methodology / practitioner prompt,The Fandom Premium,Measure whether organised fandom creates persistent optimism that differs from other forecasting signals.,Planned,High,Align market definitions and avoid treating social sentiment as representative polling.,,,,,NEXTPredict proprietary data journalism research
