Date,Day/time (ET),Channel,Format,Topic,Treatment / commercial read,Status,Priority,Verification / trigger,Linked companies (engine status + guards),Linked people (status / route / handle),Related posters today (2026-07-17 packs),Theme momentum,Source
2026-07-12,"Sun 12 Jul, 8:00 AM ET",Stuart LinkedIn,Text + image,Love Island USA and audience expansion,Use the finale as evidence that entertainment can pull prediction markets into a different audience. Avoid pretending one programme proves durable adoption.,Confirm live,High,Confirm the post published and capture first 24-hour performance.,,,,"prediction_markets (today x7, all-time 1009)",Existing master schedule
2026-07-13,"Mon 13 Jul, 9:00 AM ET",X,Single post,Polymarket Clearing rulebook changes,"Frame the US build as a clearing, customer-protection and intermediated-access story. Use only if the changes are visible in official documents.",Conditional,High,Check the 13 July rulebook version and describe only confirmed changes.,Polymarket [abm],,NEWS: CNBC · NEWS: FinanceFeeds · NEWS: AppliedXL and Kalshi · NEWS: Arizona State University / arXiv · NEWS: Samsung Securities · X: Predictefy (@Predictefy),"polymarket (today x9, all-time 1127)",Trigger dates pack
2026-07-13,"Mon 13 Jul, 10:00 AM ET",Stuart LinkedIn,Text,Prediction markets creating jobs,"Already scheduled. Treat hiring as evidence of category build mode, not as a generic jobs roundup.",Scheduled,High,Refresh named roles if the draft cites live vacancies.,,,,"prediction_markets (today x7, all-time 1009)",Existing master schedule
2026-07-13,"Mon 13 Jul, 3:00 PM ET",X,Single post,Love Island retention follow-up,"Ask whether the audience reached through entertainment trades anything else after the finale. Use a real platform, ranking or volume signal, not vibes.",Conditional,Medium,Confirm finale timing and any post-finale market or traffic data.,,,,,Existing master schedule
2026-07-14,"Tue 14 Jul, 8:20 AM ET",X,Two-post live update,US CPI market check,"Capture the market price shortly before 8:30am ET, then the immediate repricing. Post only if liquidity and movement create a useful product lesson.",Conditional,Medium,"Use BLS release time, capture timestamped prices and avoid claiming forecasting success from one print.",,,,,BLS July 2026 calendar
2026-07-14,"Tue 14 Jul, 2:30 PM ET",Stuart LinkedIn,Text + image,Weather markets and settlement sources,"Already scheduled. Keep the focus on official settlement sources, sensor edge cases and why product education cannot live in a help centre.",Scheduled,High,Check any named weather-market rule and source wording.,,,,"weather_markets (today x3, all-time 45)",Existing master schedule
2026-07-14,"Tue 14 Jul, 6:30 PM ET",X,Live observation,"World Cup semi-final: same probabilities, different product",Compare a prediction-market price with a sportsbook price at the same moment after removing bookmaker margin. Ask what differentiates the products if probabilities converge.,Conditional,High,Capture both prices at the same timestamp and document the margin calculation.,,,,"sports (today x5, all-time 1131)",Remaining post ideas / FIFA schedule
2026-07-15,"Wed 15 Jul, 8:35 AM ET",X,Single post,US PPI market reaction,"Use only if price formation, liquidity or settlement reveals something different from the CPI market. Skip generic macro commentary.",Conditional,Low,Confirm BLS time and capture the market before and after release.,,,,,BLS July 2026 calendar
2026-07-15,"Wed 15 Jul, 9:15 AM ET",Stuart LinkedIn,Text + data image,Prediction markets climbing the US App Store,Already scheduled. Treat rankings as distribution evidence and avoid turning a temporary chart position into a durable adoption claim.,Scheduled,High,Refresh rankings immediately before publication.,,,,"prediction_markets (today x7, all-time 1009)",Existing master schedule
2026-07-15,"Wed 15 Jul, 11:30 AM ET",X,Single post,Prediction markets marketed like sportsbooks,Use the New York Post and CBS Sports giving Kalshi and Polymarket publisher-specific promo codes and bonuses to show how affiliate distribution is teaching consumers which commercial box prediction markets belong in.,Ready,High,Capture both New York Post offers and the CBS Sports Kalshi and Polymarket offers. Quote terms exactly and date-stamp every page.,Kalshi [abm] · Polymarket [abm] · new york post [mentioned],,NEWS: CNBC · NEWS: FinanceFeeds · NEWS: AppliedXL and Kalshi · NEWS: Arizona State University / arXiv · NEWS: Samsung Securities · X: Predictefy (@Predictefy),"polymarket (today x9, all-time 1127) · prediction_markets (today x7, all-time 1009) · kalshi (today x6, all-time 957)",https://nypost.com/2026/07/13/betting/kalshi-promo-code-nypmax-trade-10-get-15-for-the-2026-open-championship/ | https://nypost.com/2026/07/13/betting/polymarket-promo-code-nypmax-deposit-20-get-50-for-world-cup-trades/ | https://www.cbssports.com/prediction/news/world-cup-kalshi-prediction-markets-use-promo-code-cbssports-for-golden-boot-golden-ball-trading/ | https://www.cbssports.com/prediction/news/polymarket-promo-code/
2026-07-15,"Wed 15 Jul, 6:30 PM ET",X,Live observation,Second World Cup semi-final,"Choose one product observation: contract wording, exit behaviour, liquidity, settlement or market versus sportsbook pricing. No match recap.",Reactive,Medium,Verify live prices and market wording.,,,,"sports (today x5, all-time 1131)",FIFA schedule
2026-07-16,"Thu 16 Jul, 8:00 AM ET",Stuart LinkedIn,Text + research graphic,When do prophets profit?,"Use Makers and Takers to separate forecast quality from entry price, execution, liquidity, position sizing and hedging. Keep the hedging section careful and practical.",Ready,High,"Confirm paper title, authors, findings and any hedging examples.",profit [mentioned],,,,Existing master schedule / remaining post ideas
2026-07-16,"Thu 16 Jul, 9:30 AM ET",X,Single post,Kalshi flight-cancellation contracts hit a data-rights problem,Kalshi’s proposed airport-cancellation contracts look like practical risk transfer. The sharper market-structure signal is that FlightAware’s parent RTX reportedly says its data cannot be used for prediction-market settlement under its terms.,Ready,Critical,Use the WSJ report and obtain the Kalshi contract rules or CFTC filing. Attribute RTX’s position precisely and do not imply FlightAware endorsed the contracts.,Kalshi [abm] · FlightAware [pierre-target] · wsj [mentioned],,NEWS: CNBC · NEWS: FinanceFeeds · NEWS: AppliedXL and Kalshi · X: Predictefy (@Predictefy) · X: Timcast News (@TimcastNews) · X: Quant Chad (@Autonomous_Chad),"kalshi (today x6, all-time 957)",https://www.wsj.com/business/kalshi-to-offer-contracts-predicting-flight-cancellations-aa2dd063
2026-07-16,"Thu 16 Jul, 11:30 AM ET",X,Single post,The CFTC just made contract finality the story,"The CFTC stayed Kalshi's emergency rule and directed it to fulfil open trades involving Michigan residents. Frame this as a market-integrity and contract-finality issue, rather than another generic sports-betting jurisdiction row.",Ready,Critical,"Use the official CFTC order. Distinguish the Michigan court order, Kalshi's proposed emergency rule and the Commission's stay.",Kalshi [abm] · cftc [mentioned],,NEWS: CNBC · NEWS: FinanceFeeds · NEWS: AppliedXL and Kalshi · X: Predictefy (@Predictefy) · X: Timcast News (@TimcastNews) · X: Quant Chad (@Autonomous_Chad),"kalshi (today x6, all-time 957) · sports (today x5, all-time 1131) · cftc (today x3, all-time 72)",https://www.cftc.gov/filings/documents/2026/orgcftcorderstayingkalem61407.pdf
2026-07-16,"Thu 16 Jul, 1:15 PM ET",X,Single post,Kalshi probabilities are appearing inside ChatGPT answers,"OpenAI says some World Cup queries may show clearly labelled predictive information sourced from Kalshi. The user does not need to visit an exchange, understand event contracts or think of the number as a trading product.",Ready,Critical,Use OpenAI’s official help article. State clearly that users cannot trade inside the answer and avoid unconfirmed partnership language.,Kalshi [abm] · chatgpt [mentioned] · openai [mentioned],,NEWS: CNBC · NEWS: FinanceFeeds · NEWS: AppliedXL and Kalshi · X: Predictefy (@Predictefy) · X: Timcast News (@TimcastNews) · X: Quant Chad (@Autonomous_Chad),"kalshi (today x6, all-time 957)",https://help.openai.com/articles/9237897-chatgpt-search
2026-07-16,"Thu 16 Jul, 3:00 PM ET",X,Single post,Blockchain.com embeds Polymarket,The partnership lets eligible users access Polymarket through assets already held in Blockchain.com. The commercial read is distribution: prediction markets are becoming a feature inside existing financial and crypto products.,Ready,High,Use the official partnership announcement. Confirm eligible-market wording and avoid implying universal availability.,Polymarket [abm],,NEWS: CNBC · NEWS: FinanceFeeds · NEWS: AppliedXL and Kalshi · NEWS: Arizona State University / arXiv · NEWS: Samsung Securities · X: Predictefy (@Predictefy),"polymarket (today x9, all-time 1127) · prediction_markets (today x7, all-time 1009)",https://www.prnewswire.co.uk/news-releases/blockchaincom-taps-polymarket-to-embed-prediction-markets-in-app-302824526.html
2026-07-17,"Fri 17 Jul, 8:00 AM ET",Stuart LinkedIn,Text + source reaction,The teleprompter case and the widening insider perimeter,"Open with the absurdity, then use the split internet reaction to reach the commercial read. X is asking whether surveillance worked. Reddit is asking why the market existed. LinkedIn is asking who needs to rewrite the employee handbook. Bring in Roxanne Bras Petraeus, Colin Goldman and Michael Ross only where their published views add substance.",Ready,Critical,"Keep “allegedly” throughout. Verify the more-than-$100,000 figure, the dozen-plus speeches, Kalshi’s flagging and referral, the account freeze and unpaid leave. Do not imply a final CFTC finding or settlement.",Kalshi [abm] · cbs news [mentioned],Michael Ross [candidate; LinkedIn / StarCompliance] · Roxanne Bras Petraeus [LinkedIn] · Colin Goldman [LinkedIn],NEWS: CNBC · NEWS: FinanceFeeds · NEWS: AppliedXL and Kalshi · X: Predictefy (@Predictefy) · X: Timcast News (@TimcastNews) · X: Quant Chad (@Autonomous_Chad),"reddit (today x9, all-time 98) · kalshi (today x6, all-time 957)",ABC News; AP; CBS News; Kalshi enforcement statement; Roxanne Bras Petraeus; Colin Goldman; TabbFORUM / Michael Ross
2026-07-17,"Fri 17 Jul, 10:30 AM ET",X,Single post,CFTC deadline: ten-day warning,"Pull one substantive issue from the proposal, such as gaming definitions, public-interest tests or the process for reviewing contracts. Do not post a calendar reminder.",Planned,High,Use the June 12 Federal Register proposal and quote narrowly.,,,,"cftc (today x3, all-time 72)",Federal Register 2026-11854
2026-07-17,"Fri 17 Jul, 12:00 PM ET",Stuart LinkedIn,Daily intel roundup,"Daily Intel: insider risk, biotech markets and the widening control surface","Connect the teleprompter case, Kalshi’s clinical-trial and FDA markets, the SEC-versus-CFTC watchdog debate and the expanding set of employees who now hold tradable information. Keep the reporting and the reaction separate.",Scheduled,Critical,"Use primary product and policy sources. Separate alleged misconduct, confirmed exchange controls and opinion from LinkedIn or Reddit.",Kalshi [abm] · StarCompliance [pierre-target] · AppliedXL [pierre-target],,NEWS: CNBC · NEWS: FinanceFeeds · NEWS: AppliedXL and Kalshi · X: Predictefy (@Predictefy) · X: Timcast News (@TimcastNews) · X: Quant Chad (@Autonomous_Chad),"kalshi (today x6, all-time 957) · cftc (today x3, all-time 72)",ABC News; Kalshi; AppliedXL; CNBC; TabbFORUM / StarCompliance
2026-07-17,"Fri 17 Jul, 1:00 PM ET",Prediction Markets Forum,Poll + discussion,Did the teleprompter case prove surveillance worked or the market should not exist?,Ask members to choose the biggest lesson: surveillance worked; controls reacted too late; employers need clearer rules; or the contract should not have existed. Follow with one practical question about the first control they would change.,Ready,Critical,Use the same verified factual core as the LinkedIn post and avoid treating allegations as a concluded enforcement action.,Kalshi [abm],,NEWS: CNBC · NEWS: FinanceFeeds · NEWS: AppliedXL and Kalshi · X: Predictefy (@Predictefy) · X: Timcast News (@TimcastNews) · X: Quant Chad (@Autonomous_Chad),"kalshi (today x6, all-time 957)",ABC News; AP; Kalshi statement
2026-07-17,"Fri 17 Jul, 3:00 PM ET",X,Breaking-news post,Teleprompter operator allegedly made $100K on speech markets,"Lead with the reported facts, then land the three-platform read in one line: X says surveillance worked, Reddit asks why the market existed, LinkedIn updates the staff policy.",Ready,Critical,Keep “allegedly”; cite ABC/AP; do not say the full profit was withdrawn or that a settlement has been finalised.,cbs news [mentioned],,YOUTUBE: NBC News · LINKEDIN: UM LEGACY PRESS LTD,"reddit (today x9, all-time 98)",ABC News; AP; CBS News
2026-07-18,"Sat 18 Jul, 12:00 PM ET",X,Breaking-news post,Kalshi opens markets on Minor League Baseball,"A reported first batch of seven Triple-A events is a useful distribution and category-perception signal. The useful question is whether smaller leagues gain attention, integrity risk or both when every fixture becomes tradable.",Verification queue,High,"Confirm live market pages, eligible jurisdictions, contract rules and the number of Triple-A events before publication.",Kalshi [abm],,NEWS: CNBC · NEWS: FinanceFeeds · NEWS: AppliedXL and Kalshi · X: Predictefy (@Predictefy) · X: Timcast News (@TimcastNews) · X: Quant Chad (@Autonomous_Chad),"kalshi (today x6, all-time 957) · sports (today x5, all-time 1131)",@KalshiSquare capture; Kalshi live market pages
2026-07-18,"Sat 18 Jul, 8:30 PM ET",X,Live observation,World Cup third-place match,"Leave open. Publish only if volume, pricing or product behaviour creates a point that has not already been made during the semi-finals.",Reactive,Low,Check volume and whether the observation is genuinely new.,,,,,FIFA schedule
2026-07-19,"Sun 19 Jul, 11:00 AM ET",X,Live roundup + market watch,Daily Intel: World Cup final market watch,"Use live prices, contract wording and liquidity to explain what the market is saying before kickoff. Bring in Pete Tan’s probability framing and Neil Paine’s use of market odds, without implying endorsement.",Reactive,Critical,Timestamp every price and source; verify the final schedule and market rules.,,Neil Paine [shortlist; Substack / LinkedIn search] · Pete Tan [Newsletter / LinkedIn search],,,World Cup market captures; Pete Tan; Neil Paine; official rules
2026-07-19,"Sun 19 Jul, 10:00 PM ET",X,Single post,The retention test starts now,Post shortly after the World Cup final. The tournament result matters less commercially than whether users trade another category next.,Planned,High,Confirm the final has ended and avoid unverified volume claims.,,,,,FIFA schedule / existing master schedule
2026-07-20,"Mon 20 Jul, 8:30 AM ET",Stuart LinkedIn,Daily intel roundup,Daily Intel: what survives after the World Cup?,"Round up the final’s market activity, sports-media integration and any post-event ranking or traffic signal. Tag Neil Paine or Brian Moritz only for a perspective they actually published. Stuart’s read: sport can acquire the user, but habit and product breadth must keep them.",Scheduled,Critical,Check post-final data on the morning of publication; avoid unsupported retention claims.,,Neil Paine [shortlist; Substack / LinkedIn search] · Brian Moritz [LinkedIn search],,"sports (today x5, all-time 1131)",World Cup sources; Neil Paine; Sports Media Guy; platform rankings
2026-07-20,"Mon 20 Jul, 9:30 AM ET",X,Data snapshot,World Cup numbers snapshot,"Use confirmed post-final volume, app ranking and category-share data. Lead with the platform split, but define the metric before using it. Treat any “$50B” headline as reported until the underlying methodology is reconciled.",Planned,High,"Use the $44.8B June platform total only with its stated methodology. Timestamp every dataset and distinguish notional volume, open interest, transactions and active users.",,,,"polymarket (today x9, all-time 1127) · kalshi (today x6, all-time 957)",https://coincentral.com/kalshi-and-polymarket-hit-45-billion-in-june-as-world-cup-drives-betting-surge/ | https://defirate.com/prediction-markets/volume/
2026-07-20,"Mon 20 Jul, 10:30 AM ET",Stuart LinkedIn,Developed standalone post,The World Cup final was an acquisition event. Monday is the product test.,"Develop the retention argument with concrete follow-on markets, rankings or traffic. Link the sporting attention to the bigger category question: what does a new user do when the obvious event disappears?",Scheduled,High,Use only current post-final evidence and distinguish observed behaviour from the thesis.,,,,,Daily Intel 19-20 Jul; World Cup platform data
2026-07-20,"Mon 20 Jul, 11:30 AM ET",X,Single post,Gopuff puts Polymarket in the shopping basket,"Gopuff and Polymarket are giving away $1 million in gold through an ordinary commerce purchase. Treat this as a distribution and category-normalisation signal, not a novelty giveaway.",Ready,High,Use Gopuff’s official terms. Do not imply the purchase executes a trade or that every entrant becomes a prediction-market user.,Polymarket [abm],,NEWS: CNBC · NEWS: FinanceFeeds · NEWS: AppliedXL and Kalshi · NEWS: Arizona State University / arXiv · NEWS: Samsung Securities · X: Predictefy (@Predictefy),"polymarket (today x9, all-time 1127) · prediction_markets (today x7, all-time 1009)",https://www.gopuff.com/newsroom/company-news/gopuff-polymarket-give-away-1-million-in-gold-america250
2026-07-20,"Mon 20 Jul, 1:00 PM ET",Prediction Markets Forum,Discussion prompt,Prediction prices inside ordinary sports journalism,Use Axios Cleveland citing a Kalshi price in LeBron reporting and Financial Express building a World Cup preview around Kalshi and Polymarket probabilities. Ask what standards apply when a live market number becomes a newsroom input.,Ready,High,"Timestamp every quoted market price, preserve liquidity context and separate a market signal from confirmed reporting.",Kalshi [abm] · Polymarket [abm],,NEWS: CNBC · NEWS: FinanceFeeds · NEWS: AppliedXL and Kalshi · NEWS: Arizona State University / arXiv · NEWS: Samsung Securities · X: Predictefy (@Predictefy),"polymarket (today x9, all-time 1127) · kalshi (today x6, all-time 957) · sports (today x5, all-time 1131)",https://www.axios.com/local/cleveland/2026/07/13/lebron-james-new-team-odds-kalshi | https://www.financialexpress.com/sports/france-or-spain-who-holds-the-edge-in-prediction-markets-ahead-of-blockbuster-world-cup-semi-final/4290886/
2026-07-21,"Tue 21 Jul, 8:00 AM ET",Stuart LinkedIn,Text + product image,Kalshi Pro and the private-client signal,"Move beyond the terminal screenshot. The combination of advanced workflow and a private-client division suggests a category segmenting into retail discovery, active traders and relationship-led professional service. The interface is becoming a statement about the customer Kalshi wants next.",Scheduled,Critical,"Confirm beta status, live functionality, the private-client division and Dillon Borgida’s role from primary company sources. Do not claim institutional adoption from product positioning alone.",Kalshi [abm] · the terminal [mentioned],Dillon Borgida [No verified handle],NEWS: CNBC · NEWS: FinanceFeeds · NEWS: AppliedXL and Kalshi · X: Predictefy (@Predictefy) · X: Timcast News (@TimcastNews) · X: Quant Chad (@Autonomous_Chad),"kalshi (today x6, all-time 957)",Kalshi product release; Kalshi Pro pages; LinkedIn capture relating to Dillon Borgida
2026-07-21,"Tue 21 Jul, 8:30 AM ET",Stuart LinkedIn,Text + contract-flow visual,Prediction markets have entered the clinical-trial timeline,"Kalshi and AppliedXL launched a pilot covering clinical-trial outcomes and FDA decisions. Isolating a drug catalyst from the company share price is commercially interesting. It also widens the insider perimeter to investigators, trial sites, data teams, sponsors, advisers and regulators.",Ready,Critical,"Use the official pilot announcement and rules. Confirm the 13-contract count, exact settlement sources and participant restrictions. AppliedXL provides intelligence; Kalshi remains responsible for market rules and final settlement.",Kalshi [abm] · AppliedXL [pierre-target],,NEWS: CNBC · NEWS: FinanceFeeds · NEWS: AppliedXL and Kalshi · X: Predictefy (@Predictefy) · X: Timcast News (@TimcastNews) · X: Quant Chad (@Autonomous_Chad),"prediction_markets (today x7, all-time 1009) · kalshi (today x6, all-time 957)",Kalshi News; AppliedXL; Bloomberg; STAT; Reuters
2026-07-21,"Tue 21 Jul, 11:30 AM ET",X,Single post,Goldman Sachs draws a contract-specific compliance line,"The useful signal is not a blanket ban. Goldman reportedly distinguishes sports and entertainment from company, election and financial-market contracts, suggesting risk depends on the employee-information-contract relationship.",Ready,High,Label this as a policy first reported before 13 July and recirculated during the 13-14 July news cycle. Attribute to the Financial Times/Bloomberg reporting.,Goldman Sachs [DO-NOT-DOUBLE-SEND: Stuart emailed Shekhinah (2026-06-29)],,NEWS: Samsung Securities · LINKEDIN: Phil Rosen · LINKEDIN: NeverHodl · NEWS: human Magazin,"sports (today x5, all-time 1131)",https://www.ft.com/content/7a2a3200-763f-4141-8372-f2f6afba521d
2026-07-22,"Wed 22 Jul, 8:30 AM ET",Stuart LinkedIn,Daily intel roundup,"Daily Intel: compliance, education and category identity","Connect Warrant’s marketing-compliance framing, Ben Fairbank’s licensing boundary argument and Steve Ruddock’s regulatory perspective. Stuart’s read: the category is borrowing the language of finance, crypto and sportsbooks faster than it is building a shared operating vocabulary.",Scheduled,High,Verify Austin’s identity before tagging; quote only published perspectives; check product and licensing claims.,,Steve Ruddock [shortlist; LinkedIn search] · Ben Fairbank [LinkedIn search],,"sports (today x5, all-time 1131)",Warrant / Marketing’s Most Wanted; Ben Fairbank; Straight to the Point
2026-07-22,"Wed 22 Jul, 9:00 AM ET",X,Single post,Post-tournament behaviour signal,"Use one specific signal: where volume moved, which categories gained or whether app rankings held. Do not repeat the LinkedIn post.",Conditional,Medium,Verify the signal and compare like-for-like periods.,,,,,Existing master schedule
2026-07-22,"Wed 22 Jul, 10:30 AM ET",Stuart LinkedIn,Text + earnings-call quote card,Prediction markets have entered the restructuring slide,Reuters reports Entain is removing 500 roles while citing tax pressure and growing competition from prediction markets. This is a stronger competitive signal than another volume chart: the category is now appearing inside incumbent cost and strategy decisions.,Ready,Critical,Attribute the 500-role figure and competition wording to Reuters and Entain. Keep tax increases and broader cost reduction in the causal frame.,boardroom [mentioned],,NEWS: Ryerson University,"prediction_markets (today x7, all-time 1009)","Reuters, 16 Jul 2026"
2026-07-22,"Wed 22 Jul, 1:00 PM ET",Prediction Markets Forum,Discussion prompt,What would prove the World Cup created lasting users?,"Ask which metrics matter: retention, second-category trading, active days, deposits, cohort behaviour or acquisition cost.",Planned,High,Keep the prompt short and avoid leading members to one answer.,,,,,Existing master schedule
2026-07-23,"Thu 23 Jul, 8:00 AM ET",Stuart LinkedIn,Text + regulatory graphic,Gibraltar creates a third regulatory category,Use Gibraltar’s dedicated Prediction Market Regulations as the signal. The useful commercial point is that one jurisdiction has stopped forcing the category into either gambling or financial-services language and written a purpose-built rulebook.,Verification-gated,Critical,"Obtain the regulations and regulator announcement directly. Confirm the 13 July effective date, approval process and legal carve-out before publishing.",,,,"regulation (today x7, all-time 1564)",User-supplied Gibraltar regulatory lead; primary regulations required
2026-07-23,"Thu 23 Jul, 8:30 AM ET",Stuart LinkedIn,Daily intel roundup,Daily Intel: the developer and infrastructure layer,"Use Algo Insights’ tooling roundup, Block Scholes research and the open-source repositories to show a stack forming around data, backtesting, wallet analysis and execution. Stuart’s read: the tooling layer may become commercially important before most consumers know it exists.",Conditional,High,"Open and verify repositories, maintainers, supported platforms and recent activity before tagging.",Polymarket [abm],Algo Insights [Medium / Linktree],NEWS: CNBC · NEWS: FinanceFeeds · NEWS: AppliedXL and Kalshi · NEWS: Arizona State University / arXiv · NEWS: Samsung Securities · X: Predictefy (@Predictefy),"polymarket (today x9, all-time 1127)",Algo Insights; Block Scholes Research; Polymarket_data; PMXT; prediction-market-backtesting
2026-07-23,"Thu 23 Jul, 11:30 AM ET",X,Single post,Polymarket blocked in Czechia,"Use the Czech blocking order to show how the same broad product category can be treated as a federally regulated derivatives market, a licensed prediction product or unauthorised gambling depending on geography.",Ready,High,"Confirm the Ministry of Finance listing, the 15-day ISP timetable and the local legal classification. Avoid implying a Europe-wide rule.",Polymarket [abm],,NEWS: CNBC · NEWS: FinanceFeeds · NEWS: AppliedXL and Kalshi · NEWS: Arizona State University / arXiv · NEWS: Samsung Securities · X: Predictefy (@Predictefy),"polymarket (today x9, all-time 1127)",https://sbcnews.co.uk/europe/2026/07/14/polymarket-czechia/
